Question,Response,Correctness,Summarization,Relevancy,ContextualRelevancy,Hallucination
在这次转会窗口，巴塞罗那计划如何处理财政问题以引进Amadou Onana？,巴塞罗那计划通过寻找质量预算选项来解决财政问题，以在这个转会窗口签下Amadou Onana。他们已经派遣球探前往非洲国家杯观察潜在签约球员，并正在考虑像Aboubakary Koita、Logan Costa、Lamine Camara和Kamory Doumbia这样的球员作为更实惠的替代选择，因为他们的估值较低。,0.7147441511600438,0.0,0.8,0.8,1.0
Karim Benzema在沙特阿拉伯遇到了哪些问题，这对他和俱乐部有何影响？,Karim Benzema在沙特阿拉伯遇到了困难，包括在比赛中表现出色但球队整体表现不佳，以及在赛季结束后表达了对移居沙特阿拉伯的后悔之情。这对他个人来说可能导致他希望返回欧洲寻找新的俱乐部，而对俱乐部来说，他的离开可能会影响球队的整体实力和表现。,0.7880705163616825,0,1.0,0.0,0.8
曼联球员Lisandro Martinez受伤后，球队的战术和阵容发生了什么变化？,"After Lisandro Martinez's injury, Manchester United's manager, Erik ten Hag, is likely to use Harry Maguire alongside Victor Lindelof or Jonny Evans at centre-back. This pairing is favored over playing Maguire and Raphael Varane together. Martinez's absence may also lead to Varane spending more time on the bench.",0.7598368770707127,0.0,1.0,0.8,0.0
Ferran Torres在比赛中向一名癌症患者致敬，这对球员和球迷有何意义？,Ferran Torres向一名癌症患者致敬在比赛中具有重要意义，因为这展示了他对他人的同情和善良，特别是对那些正在经历困难时期的人。这个举动不仅突显了托雷斯的同情心和慷慨，还帮助他赢得新的球迷，并因他在赛场内外的行为而受到赞赏。对于球迷来说，看到球员做出这样一种真挚的举动可以建立起强烈的情感联系，对托雷斯产生钦佩之情，增强他们对他作为球员和人的支持和欣赏。,0.9561093194156631,0,1.0,0.2,1.0
为什么Takehiro Tomiyasu在对阵West Ham United的比赛中缺席？他何时可能会重返阵容？,Takehiro Tomiyasu缺席对阵West Ham United的比赛是因为一点小问题。希望他能在阿森纳对阵波尔图的重要欧冠16强比赛之前重返阵容。,0.5987952100149692,0,1.0,0.4,1.0
巴塞罗那被Villarreal重创后，他们与皇马的积分差多少？这对巴萨的联赛前景有何影响？,根据最近的比赛结果，巴塞罗那在积分榜上排名第八，而皇马的情况未知。由于巴塞罗那在最近的比赛中输掉比赛，这可能会对他们的联赛前景产生负面影响。他们需要在接下来的比赛中取得更好的成绩来提升排名和积分。,0.3451000506534775,0.0,0.75,0.2,1.0
Cole Palmer在切尔西对阵水晶宫的比赛中表现出色，他提到了Mauricio Pochettino在胜利中的作用是什么？,Mauricio Pochettino played a role in Cole Palmer's impressive performance in the match between Chelsea and Crystal Palace by helping Palmer flourish under his management. Palmer became the first Chelsea player aged 21 or under to score double figures for goals in a Premier League season under Pochettino's guidance.,0.7696056549380665,0.0,1.0,0.0,0.0
在对阵阿斯顿维拉的比赛中，切尔西的球迷建议的终极阵容是什么？,根据球迷建议，切尔西对阵阿斯顿维拉的终极阵容可能包括阿曼多·布罗哈领衔进攻，本·奇威尔在伤愈后可能会出场。阿斯顿维拉方面，保罗·托雷斯、雅各布·兰姆齐和卢卡斯·迪涅可能因伤疑似缺阵，而莫里西奥·波切蒂诺可能会缺少几名主力球员。奥利·沃特金斯、道格拉斯·路易斯和穆萨·迪亚比有望重新进入首发阵容。,0.621446014297402,0.0,1.0,0.2,1.0
在对阵托特纳姆热刺的比赛中，曼联球迷对马库斯·拉什福德的表现有什么意见？,曼联球迷对马库斯·拉什福德在对阵托特纳姆热刺的比赛中的表现意见不一，存在不同看法。,0.6753734611266872,0,1.0,0.4,1.0
吉安路易吉·布冯表示在他职业生涯中哪个前锋对他造成了最大的痛苦？,在吉安路易吉·布冯的职业生涯中，克里斯蒂亚诺·罗纳尔多给他造成了最大的困扰。,0.7409769014880121,0.0,1.0,0.0,1.0
切尔西的蒂亚戈·席尔瓦在对阵水晶宫的比赛中做了什么冒险行为？,蒂亚戈·席尔瓦在对阵水晶宫的比赛中冒险行为是为了阻止水晶宫的马泰塔射门，冒着受伤的风险。,0.7477834439457276,0,1.0,0.2,1.0
2023年斯坦福桥的比赛中，哪位球员在第71分钟进球使阿斯顿维拉战胜切尔西？,Ollie Watkins在2023年斯坦福桥的比赛中在第71分钟进球，帮助阿斯顿维拉战胜切尔西。,0.9977045417294228,0,1.0,0.0,1.0
切尔西在2024年足总杯第三轮中以4-0战胜了哪支球队？,切尔西在2024年足总杯第三轮中以4-0战胜了普雷斯顿北端队。,0.7685214924099852,0,1.0,0.0,1.0
在2024年2月初对阵埃弗顿的比赛中，阿斯顿维拉取得了什么结果？,在2024年2月初对阵埃弗顿的比赛中，阿斯顿维拉取得了胜利。,0.7491970534984409,0,1.0,0.0,1.0
切尔西在2024年与阿斯顿维拉的比赛中，预计最有可能的比分是什么？,根据提供的信息，2024年切尔西对阵阿斯顿维拉的比赛最有可能是平局。,0.7134666567939988,0.0,0.5,0.0,1.0
2024年利物浦对阵阿森纳的比赛中，克洛普是否对达尔文·努涅斯不上场感到后悔？,克洛普在2024年利物浦对阵阿森纳的比赛中后悔没有让达尔文·努涅斯上场。,0.6507563680868279,0.0,1.0,0.0,1.0
克洛普在2024年对阵阿森纳的比赛中，提到球队应该如何提高？,克洛普在2024年对阵阿森纳的比赛中提到，球队应该进行战术调整，例如让特伦特在中场出场，戈麦斯在左后卫位置，罗伯逊在右后卫位置，并在了解阿森纳的比赛计划之前避免倒脚。他还提到需要在比赛进行到第30分钟左右立即进行替补，以唤醒球员并改善他们的逼抢。克洛普强调了对球员的严厉要求和更具侵略性的比赛方式的重要性。,0.7989868425497956,0,1.0,0.0,1.0
康纳·加拉格尔在2024年对阵水晶宫的比赛中打进了多少球？,康纳·加拉格尔在2024年对阵水晶宫的比赛中没有进球。,0.46805042883951875,0.0,0.0,0.0,1.0
康纳·加拉格尔在对阵水晶宫的比赛中，被评为比赛最佳球员后提到了什么关于主教练的战术调整？,康纳·加拉格尔在对阵水晶宫的比赛中被评为比赛最佳球员后提到了主教练在战术调整方面的做法，他提到主教练在下半场为球队的进攻提供了更多的结构。加拉格尔强调，战术调整包括让两名前锋更多地跑动，从而打开空间创造更多机会。,0.7996291883827291,0,1.0,0.0,1.0
梅西、苏亚雷斯、阿尔巴和布斯克茨在2024年为哪支球队展示了他们的出色配合？,梅西、苏亚雷斯、阿尔巴和布斯克茨在2024年为巴塞罗那展示了他们的出色配合。,0.8050392768232637,0.0,1.0,0.0,1.0
